{
  "name": "mountaineering",
  "version": "4.0.2",
  "description": "Automated mountain route research combining PeakBagger data, weather forecasts, avalanche conditions, and trip reports into comprehensive beta documents",
  "author": {
    "name": "dreamiurg",
    "email": "dreamiurg@users.noreply.github.com"
  },
  "homepage": "https://github.com/dreamiurg/claude-mountaineering-skills",
  "repository": "https://github.com/dreamiurg/claude-mountaineering-skills",
  "license": "MIT",
  "keywords": [
    "mountaineering",
    "climbing",
    "alpine",
    "route-beta",
    "trip-planning",
    "weather",
    "avalanche",
    "cascades",
    "pacific-northwest",
    "peakbagger"
  ],
  "skills": [
    "./skills/route-researcher"
  ]
}
